<?xml version="1.0" encoding="UTF-8"?>
<co:plist xmlns:vc="http://www.w3.org/2007/XMLSchema-versioning"
 xmlns:co="http://www.opendicom.com/xsd/plist/code.xsd"
 xmlns:xsi="http://www.w3.org/2001/XMLSchema-instance"
 xsi:schemaLocation="http://www.opendicom.com/xsd/plist/code.xsd file:/Users/jacquesfauquex/opendicom/httpdicom/deploy/mwl/code.xsd">
    <co:dict>
        <co:key id="id0">key0</co:key>
        <co:dict>
            <co:key>id</co:key>
            <co:string id="id">string0</co:string>
            <co:key>translation</co:key>
            <co:dict>
                <co:key id="id2">key1</co:key>
                <co:string id="id">string1</co:string>
            </co:dict>
            <co:key>code</co:key>
            <co:string id="id">string2</co:string>
            <co:key>codesystem</co:key>
            <co:string id="id">string3</co:string>
            <co:key>displayname</co:key>
            <co:string id="id">string4</co:string>
            <co:key>category</co:key>
            <co:string id="id">string5</co:string>
        </co:dict>
    </co:dict>
</co:plist>
